{
  "$schema": "https://json-schema.org/draft/2020-12/schema",
  "$id": "wol-host-protocol/response-metrics.json",
  "title": "Response to {command: metrics} (authenticated, protocol v10)",
  "description": "Sizes are bytes, percentages 0-100. null = not measurable (psutil/nvidia-smi unavailable). 'os' is optional because pre-v8 hosts omit it. See protocol/SPEC.md §4.2.",
  "allOf": [{ "$ref": "response-core.json" }],
  "type": "object",
  "required": ["status", "protocol", "hostname", "cpu", "cpu_count",
               "ram_used", "ram_total", "uptime", "gpu", "vram_used",
               "vram_total", "gpu_name"],
  "properties": {
    "status": { "const": "ok" },
    "protocol": { "type": "integer", "minimum": 1, "maximum": 10 },
    "hostname": { "type": "string" },
    "os": { "type": "string", "minLength": 1, "maxLength": 32 },
    "cpu": { "type": ["number", "null"], "minimum": 0, "maximum": 100 },
    "cpu_count": { "type": ["integer", "null"], "minimum": 1 },
    "ram_used": { "type": ["integer", "null"], "minimum": 0 },
    "ram_total": { "type": ["integer", "null"], "minimum": 0 },
    "uptime": { "type": ["integer", "null"], "minimum": 0 },
    "gpu": { "type": ["number", "null"], "minimum": 0, "maximum": 100 },
    "vram_used": { "type": ["integer", "null"], "minimum": 0 },
    "vram_total": { "type": ["integer", "null"], "minimum": 0 },
    "gpu_name": { "type": ["string", "null"] },
    "processes": {
      "type": "object",
      "maxProperties": 8,
      "additionalProperties": { "$ref": "#/$defs/watchEntry" }
    }
  },
  "additionalProperties": true,
  "$defs": {
    "watchEntry": {
      "type": "object",
      "required": ["running"],
      "properties": {
        "running": { "type": "boolean" },
        "count": { "type": "integer", "minimum": 1 },
        "pid": { "type": "integer", "minimum": 1 },
        "cpu": { "type": "number", "minimum": 0 },
        "ram": { "type": "integer", "minimum": 0 },
        "uptime": { "type": "integer", "minimum": 0 },
        "model": { "type": "string", "maxLength": 64 },
        "api_port": { "type": "integer", "minimum": 1, "maximum": 65535 },
        "api_port_open": { "type": "boolean" },
        "api_up": { "type": "boolean" },
        "requests_active": { "type": "integer", "minimum": 0 },
        "api_kind": { "type": "string", "enum": ["llama.cpp", "openai", "unknown"] },
        "api_features": {
          "type": "array",
          "maxItems": 4,
          "items": { "type": "string", "enum": ["models", "health", "props", "metrics"] }
        },
        "api_info": {
          "type": "object",
          "properties": {
            "server": { "type": "string", "maxLength": 64 },
            "context": { "type": "integer", "minimum": 1 },
            "slots": { "type": "integer", "minimum": 1 },
            "model_alias": { "type": "string", "maxLength": 64 }
          },
          "additionalProperties": true
        },
        "models": {
          "type": "array",
          "maxItems": 16,
          "items": { "type": "string", "maxLength": 64 }
        },
        "model_metrics": {
          "type": "object",
          "maxProperties": 16,
          "additionalProperties": {
            "type": "object",
            "properties": {
              "prompt_tps": { "type": "number", "minimum": 0 },
              "predicted_tps": { "type": "number", "minimum": 0 },
              "total_tokens": { "type": "integer", "minimum": 0 }
            },
            "additionalProperties": true
          }
        }
      },
      "additionalProperties": true,
      "allOf": [
        {
          "if": {
            "properties": { "running": { "const": false } },
            "not": { "required": ["api_port"] }
          },
          "then": { "maxProperties": 1 }
        }
      ]
    }
  }
}
